level,state,source_name,source_type,url,registration_required,alert_available,notes,status
Education,TX,San Antonio ISD Purchasing,K-12 procurement,https://www.saisd.net/page/procurement-services,Yes,Varies,Large school district for professional development.,Not started
Education,TX,Alamo Colleges Purchasing,Community college procurement,https://www.alamo.edu/about-us/offices-departments/departments/purchasing/,Yes,Varies,Training-aligned community college district.,Not started
Education,TX,Dallas College Supplier Information,Community college procurement,https://www.dallascollege.edu/about/business-industry/pages/supplier.aspx,Yes,Varies,Training-aligned college system and workforce partner.,Not started
Education,TX,Austin Community College Purchasing,Community college procurement,https://www.austincc.edu/offices/purchasing,Yes,Varies,Training-aligned community college district.,Not started
Education,TX,Lone Star College Purchasing,Community college procurement,https://www.lonestar.edu/purchasing.htm,Yes,Varies,Large Houston-area community college system.,Not started
Adjacent,TX,North Central Texas Council of Governments Purchasing,Regional council procurement,https://www.nctcog.org/agency-administration/purchasing,Yes,Varies,Regional council and cooperative programs can surface multi-agency needs.,Not started
Adjacent,TX,Capital Area Council of Governments Procurement,Regional council procurement,https://www.capcog.org/about/do-business-with-us/,Yes,Varies,Regional public safety and planning training potential.,Not started
Adjacent,TX,Houston-Galveston Area Council Procurement,Regional council procurement,https://www.h-gac.com/procurement,Yes,Varies,Large regional council and cooperative purchasing channel.,Not started
Adjacent,TX,HGACBuy Cooperative Bid/RFP Notices,Cooperative procurement portal,https://hgacbuy.org/bid-notices,No for browsing; account for electronic submission,Yes,Public HGACBuy OpenGov opportunity listing for nationwide cooperative contracts.,Not started
Adjacent,TX,San Antonio River Authority Business Opportunities,Special district procurement,https://www.sariverauthority.org/about/contracting/,Yes,Varies,Special district with professional staff and public engagement needs.,Not started
Adjacent,TX,Lower Colorado River Authority Business,Public utility procurement,https://www.lcra.org/business-with-lcra/,Yes,Varies,Large authority with safety leadership and supervisor training potential.,Not started
Adjacent,TX,CPS Energy Procurement and Suppliers,Public utility procurement,https://www.cpsenergy.com/en/about-us/procurement-and-suppliers.html,Yes,Varies,Municipally owned utility with workforce training fit.,Not started
Adjacent,TX,Austin Energy Vendor Information,Public utility procurement,https://austinenergy.com/about/company-profile/vendor-information,Use City of Austin,Varies,Public utility buyer usually tied to Austin vendor setup.,Not started
Adjacent,TX,San Antonio Water System Purchasing,Public utility procurement,https://www.saws.org/business-center/purchasing/,Yes,Varies,Public water utility with leadership safety and supervisor training fit.,Not started
Adjacent,TX,North Texas Municipal Water District Business Opportunities,Public utility procurement,https://www.ntmwd.com/business-opportunities/,Yes,Varies,Regional utility district and overlooked special-purpose buyer.,Not started
Adjacent,TX,Port Houston Procurement,Port authority procurement,https://porthouston.com/procurement/,Yes,Varies,High-value enterprise buyer with operations and safety leadership needs.,Not started
Adjacent,TX,TIPS-USA Cooperative Bid Opportunities,Cooperative procurement portal,https://tips.ionwave.net/SourcingEvents.aspx?SourceType=1,No for browsing; account for electronic submission,Yes,Public IonWave bid table for TIPS cooperative solicitations.,Not started
Adjacent,TX,BuyBoard Current Proposal Invitations,Cooperative procurement portal,https://www.buyboard.com/vendor/proposal-invitations,No for browsing and forms; account for electronic submission,Yes,Public proposal invitations and downloadable proposal packets for BuyBoard cooperative contracts.,Not started
Adjacent,TX,Goodbuy Purchasing Cooperative Bid Opportunities,Cooperative procurement portal,https://goodbuy.ionwave.net/SourcingEvents.aspx?SourceType=1,No for browsing; account for electronic submission,Yes,Public IonWave bid table for Goodbuy cooperative solicitations.,Not started
Adjacent,TX,Choice Partners Current RFPs,Cooperative procurement portal,https://www.choicepartners.org/current-rfps,No for browsing; account for electronic submission,Yes,Public Choice Partners current RFP page from Harris County Department of Education.,Not started
Adjacent,TX,Choice Partners Upcoming Contracts,Cooperative procurement schedule,https://www.choicepartners.org/upcoming-contracts,No,No,Public upcoming cooperative contract schedule for planning future bids.,Not started
Adjacent,US,Sourcewell Open Solicitations,Cooperative procurement portal,https://www.sourcewell-mn.gov/solicitations,No for browsing; portal account for electronic submission,Yes,Public national cooperative solicitation list with due dates and solicitation detail pages.,Not started
Adjacent,US,NASPO ValuePoint Current Solicitations,Cooperative procurement portal,https://naspovaluepoint.org/solicitation-status/,No for browsing; varies by lead state portal,Yes,Public NASPO ValuePoint current solicitation status page with lead-state links.,Not started
Adjacent,US,OMNIA Partners Current Solicitations,Cooperative procurement portal,https://www.omniapartners.com/get-started/solicitations,No for browsing; varies by lead agency portal,Yes,Public national cooperative solicitations with lead agency links and addenda.,Not started
Adjacent,US,Equalis Group Current Solicitations,Cooperative procurement portal,https://equalisgroup.org/current-solicitations/,No for browsing; varies by lead agency portal,Varies,Public national cooperative lead-agency solicitation page.,Not started
