level,state,source_name,source_type,url,registration_required,alert_available,notes,status
Education,TX,Austin ISD Purchasing,K-12 procurement,https://www.austinisd.org/cp,Yes,Varies,Large school district for administrator and professional development training.,Not started
Education,TX,Dallas ISD Procurement,K-12 procurement,https://www.dallasisd.org/procurement,Yes,Varies,Large school district with leadership and professional development needs.,Not started
Education,TX,Houston ISD Procurement,K-12 procurement,https://www.houstonisd.org/community-partnerships/purchasing-services,Yes,Varies,Large school district but complex buyer.,Not started
Education,TX,Fort Worth ISD Purchasing,K-12 procurement,https://www.fwisd.org/Page/260,Yes,Varies,Large school district for leadership and administrator training.,Not started
Education,TX,San Antonio ISD Purchasing,K-12 procurement,https://www.saisd.net/page/procurement-services,Yes,Varies,Large school district for professional development.,Not started
Education,TX,Alamo Colleges Purchasing,Community college procurement,https://www.alamo.edu/about-us/offices-departments/departments/purchasing/,Yes,Varies,Training-aligned community college district.,Not started
Education,TX,Dallas College Supplier Information,Community college procurement,https://www.dallascollege.edu/about/business-industry/pages/supplier.aspx,Yes,Varies,Training-aligned college system and workforce partner.,Not started
Education,TX,Austin Community College Purchasing,Community college procurement,https://www.austincc.edu/offices/purchasing,Yes,Varies,Training-aligned community college district.,Not started
Education,TX,Lone Star College Purchasing,Community college procurement,https://www.lonestar.edu/purchasing.htm,Yes,Varies,Large Houston-area community college system.,Not started
Adjacent,TX,North Central Texas Council of Governments Purchasing,Regional council procurement,https://www.nctcog.org/agency-administration/purchasing,Yes,Varies,Regional council and cooperative programs can surface multi-agency needs.,Not started
Adjacent,TX,Capital Area Council of Governments Procurement,Regional council procurement,https://www.capcog.org/about/do-business-with-us/,Yes,Varies,Regional public safety and planning training potential.,Not started
Adjacent,TX,Houston-Galveston Area Council Procurement,Regional council procurement,https://www.h-gac.com/procurement,Yes,Varies,Large regional council and cooperative purchasing channel.,Not started
Adjacent,TX,San Antonio River Authority Business Opportunities,Special district procurement,https://www.sariverauthority.org/about/contracting/,Yes,Varies,Special district with professional staff and public engagement needs.,Not started
Adjacent,TX,Lower Colorado River Authority Business,Public utility procurement,https://www.lcra.org/business-with-lcra/,Yes,Varies,Large authority with safety leadership and supervisor training potential.,Not started
Adjacent,TX,CPS Energy Procurement and Suppliers,Public utility procurement,https://cpsenergy.sbecompliance.com/FrontEnd/ProposalSearchPublic.asp?TN=cpsenergy&XID=,No for browsing; supplier account for submission,Yes,Municipally owned utility. Public B2GNow proposal-search listing is wired.,Wired
Adjacent,TX,Austin Energy Vendor Information,Public utility procurement,https://austinenergy.com/about/company-profile/vendor-information,Use City of Austin,Varies,Public utility buyer usually tied to Austin vendor setup.,Not started
Adjacent,TX,San Antonio Water System Purchasing,Public utility procurement,https://www.saws.org/business-center/purchasing/,Yes,Varies,Public water utility with leadership safety and supervisor training fit.,Not started
Adjacent,TX,North Texas Municipal Water District Business Opportunities,Public utility procurement,https://www.ntmwd.com/business-opportunities/,Yes,Varies,Regional utility district and overlooked special-purpose buyer.,Not started
Adjacent,TX,Port Houston Procurement,Port authority procurement,https://porthouston.com/procurement/,Yes,Varies,High-value enterprise buyer with operations and safety leadership needs.,Not started
